;city;hotel_name;ind_rating;review_txt
588;Lyon;Hôtel Mercure Lyon Centre Lumière;3.0;J'ai été très bien accueilli par la réceptionniste. L'hôtel est à quelques encablures à pied d'une station de tram (15 mn de marche/) ou de métro( 5 mn de marche) La chambre n'a rien d'extraordinaire pour la catégorie de l'hôtel (4*). La principale déception que j' ai eue pour sur une salle de bain exiguë et notamment les WC qui son coincés contre un mur. C'est à la limite de l'accessibilité ! J'ai également constaté que le lavabo était bouche ce qui suscitz une interrogation sur l'entretien. Au global,un sentiment assez mitigé.
589;Lyon;Hôtel Mercure Lyon Centre Lumière;2.0;J'ai souffert du froid 3 nuits durant dans la chambre. Je l'ai signalé 1 heure après avoir pris possession de la chambre voyant bien qu'elle ne chauffait pas.On m'a indiqué que l'hôtel étant complet il n'y avait pas de solution...Je suis pourtant membre Accor Platinum...
590;Lyon;Hôtel Mercure Lyon Centre Lumière;5.0;Hôtel très agréable.Personnel efficace et présent.Petit déjeuner copieux avec un choix très étendu. Je m'y sens toujours bien à chaque passage. Un plus, le garage souterrain pour y parquer son véhicule.Je recommande bien sûr cet hôtel.
591;Lyon;Hôtel Mercure Lyon Centre Lumière;5.0;J'ai été surclassé dans une chambre très confortable, spacieuse, très bien équipée. Salle de bain très propre, fonctionnelle avec douche à l'Italienne.Accueil chaleureux avec remise immédiate de la clé le check in étant réalisé.
592;Lyon;Hôtel Mercure Lyon Centre Lumière;4.0;Établissement agréable. Très bon accueil. Chambres agréables et bien décorées.  La salle de petit déjeuner au rez de chaussée à côté de la réception est moins agréable que celle au premier étage. Bon jus d’orange naturel. Pour le reste, peu de produits originaux et locaux. D’autres Mercure offrent de meilleurs petits déjeuners moins standardisés 
593;Lyon;Hôtel Mercure Lyon Centre Lumière;5.0;Très bon hôtel Propre mais literie un peu trop dur.Restaurant top. Le parking sous terrain un peu cher et compliquer d accès et limiter en place  Hormis cela personnel agréable. Isolation très bonne  Un peu cher mais sympa
594;Lyon;Hôtel Mercure Lyon Centre Lumière;5.0;Nous avons été invités à la soirée et au buffet d'inauguration de la nouvelle formule de l'hôtel (après rénovation). C'était sympathique et bon.Merci tout particulièrement à la personne à l'accueil tous les soirs qui était très conviviale et souriante.
595;Lyon;Hôtel Mercure Lyon Centre Lumière;2.0;Le lendemain de mon séjour à l'hôtel je reçois un Mail de me demandant de repayer la facture déjà payer un mois plut tôt lors de la réservation.J'adresse comme convenu un relevé de ma carte American Express en demandant une réponse.Deux jour plus tard ni nouvelle nui excuse pour cette maladresse de la part du service comptable. Cela gâche un peu le séjour dans cet hôtel .
596;Lyon;Hôtel Mercure Lyon Centre Lumière;3.0;Hôtel bien situé à proximité d'une station de métro et du très intéressant musée Lumière. Aire de repas-bar-accueil peu conviviale. Parking exigu, conçu pour des citadines, pas pour de grandes routières.
597;Lyon;Hôtel Mercure Lyon Centre Lumière;3.0;"Nous sommes clients habituels des hôtels Mercure, notamment du Limoges Royal Limousin. Nous n'avons pas reconnu les prestations auxquelles nous étions habitués. La chambre ""Privilège"" plus petite (au moins 20%) logée au 5ème étage sur cour, et avec la VMC de l'immeuble juchée sur le toit et qui tourne bruyamment toute la nuit. Quant au petit-déjeuner buffet, il était simplement inexistant en ce samedi matin, à 9h30, sans doute totalement ""pillé"" par un groupe de touristes matinaux, et pas du tout réapprovisionné ensuite (il restait 4 pauvres viennoiseries). Heureusement le buffet du dimanche et du lundi était correct (les ""vandales"" du samedi étant partis). Les points positifs de cet hôtel sont l'accès direct du parking aux étages desservant les chambres, la proximité des…"
598;Lyon;Hôtel Mercure Lyon Centre Lumière;5.0;C’était mon deuxième passage dans ce mercure. L’accueil est toujours aussi soigné et chaleureux. Chambre était impeccable. J’ai passé 3 heures à travailler dans le café -retaurant du rez de  chaussé - musique d’ambiance bien choisie - bref j’étais  productif. Le petit déjeuner est toujours aussi bon - produits frais comme toujours. Je reviendrai lors de mon prochain passage à Lyon.
599;Lyon;Hôtel Mercure Lyon Centre Lumière;4.0;"La rénovation de l'espace ""restaurant"" est une réussite.Comme expliqué à la directrice, nous avons eu un petit désagrément avec la quasi absence du chauffage dans la chambre, et surtout la salle de bain : nous ne savions pas qu'il y avait une maintenance 24/24. D'autre part au parking 1, la place PMR était occupée par une voiture qui n'avait pas le macaron ""handicapé"", et mon épouse est en fauteuil roulant... On ne savait pas non plus qu'il y avait un 2ème parking : ce serait logique que les deux places ""handicapé"" soit au P1. Cela ne nous empêchera pas de revenir dans cet hôtel comme d'habitude lorsque nous venons à Lyon !!!"
600;Lyon;Mama Shelter Lyon;5.0;Au top !! Super accueil. Grignotage et vins au comptoir. Très bonne ambiance. Détendue, hype, branchée mais rien de surfait. DJ sympa permettant de se parler malgré la musique. Les cocktails au top ! Chambre design hyper confort. Très propre. Petit déjeuner varié sucré et salé. Prix correct. Rien à redire hormis ... profitez en 😊😊😊
601;Lyon;Mama Shelter Lyon;5.0;"Le comfort des petites chambres est limité mais la literie est de grande Qualité (matelas et couette). On n'est pas vraiment là pour le grand comfort mais plutôt pour les décor un peu déjanté de l'hôtel, son ambiance unique et conviviale, l'amabilité et la décontraction des collaborateurs/trices et au final le sentiment d'adhérer spontanément à cette joyeuse et bizarrement attachante proposition. L'offre bar/restaurant est très bien pensée et bien logiquement ""populaire! Concept réussi ! Laissez vos idées d'une hôtellerie classique à la maison !"
602;Lyon;Mama Shelter Lyon;5.0;très bon accueil, ambiance, qualité des produits. Pour une soirée du 31/12, ayant invité des clients, j'ai été très agréablement surpris par la qualité du séjour . très bien organisé et  gentillesse du personnel
603;Lyon;Mama Shelter Lyon;4.0;"Style Mama Shelter aux attentes, l'ambiance animée est agréable pour une période de fêtes. Produits de SDB un peu limite pour 2 personnes. Formule buffet oblige, la note petit déj est ""salée"" pour ceux qui ne font pas un repas complet le matin... "
604;Lyon;Mama Shelter Lyon;5.0;Excellent réveillon passé au Mama ! Une équipe au top ,une ambiance de feu 🍾🥂✨🎉 et un réveillon réussi avec nos amis!  A refaire et a recommandé ! Great team, great moment ! Thé place to bé at Lyon !
605;Lyon;Mama Shelter Lyon;4.0;L’hotel est bien avec des chambres moyennes assez petites mais une salle de bain d’une taille parfaite. Tout était propre Nous avons dormis sur la petite rue ce qui permet de ne pas être dérangés par le bruit. L’hotel est situé loin du centre touristique sans aucune animation aux alentours.  Quant au restaurant, confortable et chaleureux, le diner était bon mais sans plus. Nous n’avons pas trouvé le rapport qualité prix au top.  Le petit déjeuner en revanche était excellent et varié. 
606;Lyon;Mama Shelter Lyon;5.0;Une envie de découvrir Mama Shelter avec la fête de Nouvel an à célébrer. Nous ne sommes pas déçus. L’accueil est chaleureux et agréable, la réception  est disponible. Les chambres sont propres, confortables, spacieuses, bien insonorisées et bien équipées. Bon rapport qualité/prix Le bar est convivial, les tarifs sont corrects et la nourriture est bonne. Le buffet du petit déjeuner est parfait, très copieux et varié. Pour la soirée du Nouvel an, nous avons passé un moment très agréable au bar. Le personnel attentif, un service parfait, des bonnes planchas, de très bons cocktails, du bon champagne aussi. Merci à Victor, Maxime, Vic et toute l’équipe de la salle de restaurant qui nous a accueillis pour le 31 décembre dans une ambiance joyeuse.  Un hôtel que je recommande vivement…
607;Lyon;Mama Shelter Lyon;3.0;Une nuit confortable malgré le chauffage en panne (fin décembre). Literie confortable, manque de rangements dans la chambre. Le personnel très sympathique. Un bémol, des vitrines dans le hall qui proposent les différents produits mis en vente par l'hôtel (gadgets et produits dérivés) et dans lesquels JOUETS pour enfants et SEX TOYS se côtoient ! L'établissement étant très fréquenté par les enfants, ce rapprochement apparait comme très déplacé, voire gênant.
608;Lyon;Mama Shelter Lyon;5.0;Surprenant ! Voilà la première impression lorsqu'on entre au Mama Shelter de Lyon. D'abord pour ce côté décalé, osé. Passé cette impression, on va de surprises en surprises. L'accueil est excellent, on a rarement vu des personnes aussi agréables, souriantes,accueillantes. Les chambres sont top, déco originale, literie qu'on rêverait tous d'avoir chez soit. Passage au bar/restaurant, incroyable. Une ambiance jamais vue dans un hôtel, on voudrait faire la fête toute la nuit ! Pas besoin de prévoir autre chose qu'une soirée la bas. Tout un concept. Et pour finir, le petit déjeuner... Encore une fois rien à redire !! Tout est bon, la possibilité de se faire ses jus, un choix de thés de qualité, viennoiseries, Charcuterie, légumes omelettes et j'en passe. Et tous ça dans une ambiance…
609;Lyon;Mama Shelter Lyon;5.0;Bel hotel  Deco tres original ,style decale avec beaucoup de gout .j adore . Chambre et literie au top . Petit dejeuner impressionnant.  Une équipe tres a l ecoute ,souriant . Je recommande cet hotel bien situe .
610;Lyon;Mama Shelter Lyon;5.0;On aime toujours ce côté décalé, sans prise de tête et en même temps tout est bien pensé ! Rien ne manque dans cette chambre, la salle de bain est parfaite, jusqu’au VRAI sèche cheveux, chose suffisamment rare pour être signalée, avis aux autres hôteliers et leur sèche cheveux mural qui ne sert à rien....petit déjeuner parfait, tout y est également, on y passe un bon moment. 
611;Lyon;Mama Shelter Lyon;4.0;Mama Shelter a su développer une ambiance très jeune et très atypique. Le cadre est vraiment très agréable. Le bar / restaurant est d'une très bonne qualité. Je viens toujours avec plaisir chez Mama Shelter. Les chambres sont spacieuses et la literie très confortable. Un moment très reposant surtout en déplacement. Je reviendrais.
612;Lyon;Mama Shelter Lyon;5.0;J'ai séjourné 1 nuit au Mama Shelter de Lyon, j'ai adoré: depuis l'accueil à la reception en passant par le service lors du diner au resto où la musique passé par le dj ce soir ! Le repas servi durant mon diner au resto était tres bon, et le petit déjeuner tres bien également.
613;Lyon;Mama Shelter Lyon;5.0;"C'est mon 3ème séjour au Mama Shelter de Lyon. Toujours la même qualité de service, propreté, efficacité, tendance, sympa;..Du Mama Quoi !  Je suis déjà allée sur le Mama de Bordeaux, de Toulouse et Marseille : même environnement ...ça devient ma maison de déplacements."
614;Lyon;Mama Shelter Lyon;5.0;Nous étions avec notre enfant donc grosse poussette. On nous a placé dans un endroit tranquille avec peu de passages. Les plats sont bons et les cocktails aussi. Après, niveau tarif, ça reste un peu plus élevé. Mais bon, le personnel est super et le service efficace donc on reviendra ! 
615;Lyon;Mama Shelter Lyon;5.0;L'hôtel est magnifique et très original.  Les chambres sont belles, propres ... Mention spéciale pour les équipes qui sont au top et donnent vraiment envie de revenir ! Merci à tous et à très bientôt :)
616;Lyon;Mama Shelter Lyon;5.0;L’hôtel est moderne, bien décoré et très original. Les chambres sont spacieuses et confortables. Le restaurant, que ce soit pour le petit déjeuner, le déjeuner ou le dîner est de qualité. Excellente ambiance, bien fréquenté, je recommande vivement cet établissement 
617;Lyon;Mama Shelter Lyon;5.0;mais dommage que mon budget professionnel ne me permette pas d'y séjourner plus.... donc je profite de certaines offres , mais malheureusement  pas assez à mon goût. on s'y sent tellement bien et l'accueils des équipes est exceptionnel....
618;Lyon;Mama Shelter Lyon;5.0;L’hôtel est très bien situé à deux pas du bus et d’une station de métro.   Les chambres sont confortables et les salles de bain sont très propres  Le petit déjeuner est formidable 👍je recommande 😉 !!!!
619;Lyon;Mama Shelter Lyon;5.0;Le MAMA c'est se sentir aussi bien que chez soi avec un personnel qui prend soin de vous comme de sa famille. J'étais seule et on remarque d'autant plus les sourires, les petits mots et les attentions. Mention spéciale au personnel du petit-déjeuner qui s'est montré exceptionnellement prévenant malgré l'affluence. La chambre était grande, la TV avec les films à la demande super, la douche très agréable et la vue sur Fourvière le petit plus :) A faire et à refaire, merci!
620;Lyon;Mama Shelter Lyon;4.0;Surprenant hôtel qui fait vite oublier sa situation dans un quartier sans grand intérêt et assez éloigné des lieux de balades touristiques Lyonnaises. Un décor industriel brut de béton, des chambres au mobilier contemporain minimaliste mais fonctionnel, une literie de grande qualité et luxe suprême un très bel écran i Mac d'Apple en guise de TV et d'accès multimédia. Un immense et beau buffet offrant un très large choix pour composer d'excellents petits-déjeuners, continental ou anglais, au gré de ses envies. Personnel sympathique et professionnel. Un hôtel au concept original mais qui respecte les essentiels de la tradition hôtelière. Une bonne adresse avec un rapport qualité/prix très correct.
621;Lyon;Mama Shelter Lyon;5.0;"Nous avons passé un week-end en famille (2 adultes et 1 enfant), ayant réservé sur le site de l'hôtel. Première bonne surprise, pour 300 € les deux nuits, nous avons eu droit à 2 chambres communicantes, avec en plus le petit déjeuner compris pour ma fille. L'accueil est attentionné et décontracté, le bar/restau très original et très cocoon... on a pas envie de sortir ;-) . Le buffet de petit déjeuner est superbe et là encore, le service et l'accueil sont souriants, détendus et vraiment efficace. Le grand plus des chambres est la literie, exceptionnellement confortable. Une vraie réussite, nous sommes ravis de notre week-end et étions tristes de partir. Deux petits bémols toutefois : la situation de l'hôtel dans un quartier un peu tristounet (mais métro et bus à 200 mètres) et la…"
622;Lyon;Mama Shelter Lyon;5.0;Super accueil à chaque passage à la reception ou restaurant. Petit déj extra avec du choix sans superflu et une super qualité. Chacun peut meme faire son jus de fruits grâce aux fruits legumes dans un panier.  Chambre super propre. Nous n'avons pas pu tester le restaurant mais dès qu'on retourne à Lyon on le fait.  Nous y étions avec des enfants de 8 et 11 ans. C'est aussi bien pour les Jeunes que pour les Familles fun :)   Aucun regret
623;Lyon;Mama Shelter Lyon;4.0;Je trouve que le rapport qualité / prix du Mama Shelter est excellent. 107 euros, petit déjeuner buffet inclus, me paraît être un prix raisonnable quand la chambre est jolie et propre, et la nourriture excellente. L’hôtel est situé dans un quartier calme avec des places de parking gratuites juste à côté.  La chambre et la salle de bains sont modernes et propres, la literie très confortable. Le petit déjeuner est vraiment excellent et complet, tant pour la partie salée que sucrée. Le seul petit bémol me concernant c’est que la chambre qui nous a été attribuée donnait côté rue et notamment sur un city-stade très très bruyant. Le double vitrage n’arrête pas le bruit des ballons de basket des joueurs infatigables qui jouent des heures durant :)
624;Lyon;Mama Shelter Lyon;2.0;"J’adore Starck et je dors systématiquement dans un Mama donc je suis un client depuis l’inauguration à Paris. Deux chambres réservées pour le boulot et des problèmes : - j’ai payé une Mama Penthouse avec baignoire sur la réservation et il n’y en avait pas ! Erreur d’attribution, fausse information... Toujours pas de réponse malgré mes demandes (Chambre attribuée : 703) ; - Ma chambre... (301) l’ordi est de travers, une ancienne fixation de tv disgracieuse est apparente juste au dessus du Mac dont les fils pendent sur la table, un branchement électrique douteur juste au dessus du lavabo, une rustine dans le bac de douche dont le nettoyage laisse à désirer (noir sur les vitres et poil d’un précédent visiteur difficile à manquer sur le carrelage blanc). Et le pire, le joint de…"
625;Lyon;Mama Shelter Lyon;5.0;un personnel très pro bien qu'yper décontracté! très à l'écoute et hyper réactif des locaux confortables, très bien équipés et originaux un  hébergement dont le rapprot qualité prix est optimal  que dire de plus j'n suis à ma 7 eme réunion organisée pour un groupe de 20 personnes sur 2 jours et encore une fois c'est un sans faute!!!
626;Lyon;Mama Shelter Lyon;5.0;Brunch excellent avec un choix immense, à volonté. Nous seront obligés d'y retourner car pas assez de place dans nos estomacs pour tout goûter 😉 Jus de fruits pressés, des buffets très bien garnis et un service au top. Prix un peu élevé (39 euros par personne) mais la qualité est au rendez-vous (et ils prennent les tickets resto !)
627;Lyon;Mama Shelter Lyon;5.0;J adore  ce lieu branché ou une fois de plus nous avons passé une excellente soirée , mes amies étaient ravies de cette découverte .  Un bon DJ , un quizz , de bons cocktails tout était réuni pour une ambiance parfaite  Toujours une réussite 👍
628;Lyon;Mama Shelter Lyon;3.0;Esprit jeune et branché , literie et chambre agréable .. Par rapport a la réservation, il manquait le mini bar , les films à la demande ne fonctionnaient pas , problème de wifi.. Restaurant débordé donc ce fut long !! Rapport qualité prix ok pour la chambre mais élevé pour le restaurant.. Parking abordable, même avec une voiture un peu grande
629;Lyon;Mama Shelter Lyon;4.0;Accueil très sympathique , possibilité de parking. Ambiance rigolote et branchée, la chambré très propre et déco décalée, ambiance béton brut. Literie parfaite , pas de bruits de la rue... mais une petite bouilloire aurait été appréciée dans le tout petit espace cuisine.Les petits déjeuners sont à un prix exorbitants, donc pouvoir se faire un thé... Restaurant incroyable pour la décoration,l’ambiance avec DJ, super sympa mais pas vraiment bon, dans la capitale de la bonne bouffe!Allez y pour un verre et pour l’ambiance, pas plus.Mais le personnel et le service sont top, souriants et empressés, donc une expérience globalement très agréable et à recommander!
630;Lyon;Mama Shelter Lyon;4.0;L'hotel est très joli, le restaurant très bon mais la chambre médium reste très petite pour le prix et les couloirs sont très bruyants assez tôt le matin : ne tentez pas la grasse matinée c'est perdu d'avance par contre le petit déjeuner brunch est très bien servi : du coup ça vaut presque le coup de ne pas faire de grasse matinée!  
631;Lyon;Mama Shelter Lyon;5.0;Super weekend passé au Mama Shelter de Lyon. L’accueil était impeccable. La chambre très bien et propre. La literie est très confortable. L’apple Tv est pratique.  L’hôtel est aussi bien situé à proximité du métro pour aller au centre ville. 
632;Lyon;Mama Shelter Lyon;3.0;Les chambres sont confortables et très propres par contre pas une bouteille d’eau pas de frigo pas de mini bar donc.... Pas de bouilloire c’est très succinct.... À côté de ça vous avez un écran Apple dans la chambre .... Les salles de réunion sont bien équipées par contre .  Le restaurant nous étions en groupe et on est assez unanime c’est pas bon . 2 repas d’affilée des filets de poulet pas cuits c’est très moyen ! Les conso ne sont pas données 6€ la bouteille d’heineken, pas de bières pression . Je n’y retournerai pas volontiers . 
633;Lyon;Mama Shelter Lyon;5.0;un séminaire de deux jours très bien passé grâce à un accueil jeune dynamique et aux petits soins pour la clientèle. la décoration est très originale de même qu'au restaurant des grands plats sont servis (comme à la maison)
634;Lyon;Mama Shelter Lyon;5.0;Equipe   géniale d'amabilité enrobée de joie de vivre dans un écrin de  professionnalisme.  Magnifique découverte gustative et hôtelière . je recommande vraiment.  j'ai hâte de voir les autres MAMA de Bordeaux , Paris , voir a l'internationale .
635;Lyon;Mama Shelter Lyon;5.0;Super Deco très original. Personnel à l’écoute et très agréable. A savoir parking gratuit si on mange au resto. Convivial car ce sont des plats à partager. Je recommande le bœuf thaï avec frite maison excellent !!!
636;Lyon;Mama Shelter Lyon;4.0;J'y suis allé pour boire un verre entre amis sur la terrasse. C'est un endroit très sympa pour l'apéro. Je n'ai pas eu l'occasion de dîner, mais les plats semblaient bons. je recommande pour une petite sortie lyonnaise
637;Lyon;Mama Shelter Lyon;4.0;Établissement faisant partir d’une chaîne avec des standards propreté et services toujours à un très bon niveau. La chambre est bien et bien équipée et l’espace commun restaurant et terrasse sont de qualité donc très bien pour quelques nuits plutôt dans un cadre professionnel car le quartier n’est pas idéal pour Le tourisme 
638;Lyon;Mama Shelter Lyon;4.0;Un accueil sympathique, la chambre propre et confortable mais petite, déco originale, ça change. L'ensemble est dynamique, le bar est très sympa , animé et  lui aussi original. Il y a une bonne ambiance et on se sent très vite à l'aise.  Bon PDJ
639;Lyon;Mama Shelter Lyon;5.0;"C'est un bonheur de s'arrêter pour une halte d'une nuit avant de rentrer définitivement de vacances; on est encore en vacances et on arrive et repart avec le sourire. L'hôtel est impeccable; chambre familiale superbe (vrais lits pour les entants et vraie salle de bains); le restaurant était top et le déjeuner aussi.  Visite de Lyon vaut le détour."
640;Lyon;Mama Shelter Lyon;5.0;Du haut de gamme... hôtel bien situé dans Lyon, des chambres spacieuses, propres et agréables... petit déjeuner extra. Accueil très sympathique A recommander ! Des attentions pour le chien... tout y est !  N’hésitez pas ! 
641;Lyon;Mama Shelter Lyon;5.0;Nous avons passé une nuit dans cette hôtel et c'est toujours autant bien.les chambres toujours au top, la restauration toujours creative, Son bar toujours original avec un multiple choix, le personnel du bar et restaurant ainsi que son directeur au top du top du top. Seul Point négatif le sourire de la réception. Merci à bientôt
642;Lyon;Mama Shelter Lyon;5.0;Super hôtel (pour un 2 étoiles), localisation parfaite par rapport à notre séjour à Lyon (stage à l'école des dj à l'UCPA).  Hôtel près d'une station de métro (Jean Macé) nous permettant de nous rendre facilement et rapidement au centre de Lyon pour y faire un peu de tourisme (vieux Lyon, Basilique, Cathédrale, Confluences, shopping à Part Dieu,....) .  Le personnel tant à l'accueil qu'au restaurant est juste topissime 😍!!!! Le petit déjeuner... Gargantuesque ☺️ et excellent.  Le repas du soir très bon et pour des prix tout à fait corrects et tout ça dans une super ambiance avec la présence d'un dj.    La chambre (XXL Mama Corner Terrace) est immense et à une superbe et grande terrasse (avec table de ping pong, tables et chaises et immense sofa) avec vue sur la Basilique. Dans…
643;Lyon;Mama Shelter Lyon;5.0;Le Mama a Lyon est un peu notre repère ! Les chambre sont pratiques et design et très propres.  L’atmosphère décontracté.  On craque surtout pour le petit déjeuner gargantuesque !! L’extracteur de jus est une idée en or pour bien débuter la journée.  Nous y avons établis notre quartier ! Mention spéciale à David Michel pour son écoute et son attention que nous avons appréciée.  
644;Lyon;Mama Shelter Lyon;5.0;Excellente étape  Un parking couvert sur place La chambre familiale est super  Le petit-déjeuner est excellent  Pas besoin de chercher un bouchon pour dîner : le restaurant est très bien Apéro cocktail de bon goût 
645;Lyon;Mama Shelter Lyon;2.0;Bon accueil, personnel sympa mais prix au bar un peu élevé. Tout s’est bien passé jusqu’au moment de payer car cet hotel n’accepte pas les cheques vacances! C’est fort dommage... Incompréhensible pour un établissement qui se dit moderne et branché.
646;Lyon;Mama Shelter Lyon;5.0;Exellent hôtel. De la réception au restaurant un personnel cool et professionnel. Un bar très convivial. Un litterie parfaite. Belle ambiance au bar pour un dimanche soir. Parfaitement situé au centre ville. Merci au mama shelter de lyon !
647;Lyon;Mama Shelter Lyon;5.0;Des chambres très propres et joliment décorées de façon moderne et amusantes Amabilité du personnel dans un quartier sympa  Le petit déjeuner est un délice j'ai rarement vu une telle variété de mets proposés  Le restaurant vaut aussi le détour par la qualité et quantité des mets  je recommande fortement
