;city;hotel_name;ind_rating;review_txt
287;Lyon;Mercure Lyon Centre Beaux Arts;4.0;Accueil très agréable service compétent A deux pas de la rue Mercière et de  la place des Jacobins (magnifique le soir avec son éclairage ) Belles promenades à faire le soir.Dans la journée vous avez la place Bellecour en sortant de l'hôtel en alllant sur votre gauche à 200m environ avec départ pour LYON CITY BUS .Par contre si vous allez à droite en sortant de l'hôtel à 400m vous verrez l'église Saint Nizier avec les boutiques situées le long de la nef L'entrée se fait de l'autre côté  Petit conseil : prenez votre petit déjeuner de bonne heure car la salle est petite et cela pose problême pour avoir une place
288;Lyon;Mercure Lyon Centre Beaux Arts;5.0;En plein centre de l’ile, dans la très belle rue du Pdt Édouard Herriot, où se trouvent toutes les jolies boutiques, un bel  hôtel accueillant et chaleureux. Bien que la décoration des chambres soit assez standardisée, elles sont très confortables et agréables. Un excellent rapport qualité prix, compte tenu de l’emplacement de rêve avec vue sur la magnifique fontaine des jacobins, et de la prestation. Et une équipe formidable.
289;Lyon;Mercure Lyon Centre Beaux Arts;5.0;Je suis allé avec mon fils dans cet hôtel 4 jours. Dès l'arrivée nous avons été surclassé dans une chambre privilège. Génial !!:). La chambre était luxueuse et grande. Le personnel à l'accueil jeune et très professionnel.  Voilà un hôtel que je recommande vivement à qui veut visiter le centre de cette jolie ville.
290;Lyon;Mercure Lyon Centre Beaux Arts;4.0;Très bon accueil, cet hôtel est propre bien entretenu. La chambre petite, propre, bien insonorisée. Bouteille d'eau offerte. Petit-déjeuner, très copieux fruits frais pressés, laitages, charcuterie, oeufs, viennoiseries et pains. Parking indépendant et payant à proximité.
291;Lyon;Mercure Lyon Centre Beaux Arts;3.0;"Un hôtel standard Accor, donc accueil, service sans problème mais quelques désagréments qui ne devraient pas dans un hôtel 4 étoiles : * une chambre qui sent (fort) le tabac, inadmissible pour un hôtel non-fumeur et, malgré les efforts du personnel, pas d'amélioration notable. * une climatisation plus que faible. * literie ""dure"". * un prix trop élevé."
292;Lyon;Mercure Lyon Centre Beaux Arts;4.0;Très bel hôtel parfaitement situé , chambres rénovées mais pourraient être mieux agencées (vrai bureau et étagères dans le placard). Literie parfaite, draps de bain aussi et superbe pare douche. bonne clim et insonorisation top malgré le passage dans la rue. Les étages élevés sont appréciables avec petit balcon et le personnel fait au mieux pour vous satisfaire. Un petit moins pour le buffet déjeuner, moins bien que dans certains hôtels de la chaîne. Les viennoiseries sont excellentes et le jus d'orange frais aussi mais l'ananas en boite, les oeufs trop cuits et réchauffés ainsi que le pain surgelé cuit mais pas très frais ne sont pas dignes de l'établissement. Nous conseillons néanmoins pour la situation et le confort.
293;Lyon;Mercure Lyon Centre Beaux Arts;5.0;Tout le personnel de cet hôtel est charmant et fait tout pour satisfaire le client. L'hôtel est placé idéalement sur la presqu'île à deux pas des métros  Bellecour ou cordelier. La chambre privilège est grande, propre, calme et bien climatisée car nous nous y trouvions en pleine canicule. Le buffet du petit déjeuner est copieux. Je recommande vivement cet hôtel avec donc une mention spéciale pour tout le personnel. 
294;Lyon;Mercure Lyon Centre Beaux Arts;5.0;Très bien accueillis par un staff agréable et souriant. La chambre était parfaite, nous avons très bien dormi dans un lit très confortable. Le petit-déjeuner très copieux et fort bon. Ce n'est pas la première fois que nous descendons dans cet hôtel ... nous le recommandons!
295;Lyon;Mercure Lyon Centre Beaux Arts;4.0;Hotel tres bien,bon déjeuner assez complet ,personnel tres serviable , Hotel près de tout pas besoin de prendre un taxi pour aller dans le vieux Lyon ,ou manger au resto  Par contre demander une chambre aux etages superieurs car ont entend les gens marché dans leurs chambre s ilne sont pas délicat 
296;Lyon;Mercure Lyon Centre Beaux Arts;4.0;Je viens de séjourner dans cet hotel  Très bien placé au centre ville Chambres très propres  Petit dejeuner très bon . Salle un peu petite  Personnel très serviable . J'ai demandé à changer de chambre , cela a été fait de façon idéale, la responsable s'est parfaitement occupé de nous  Silencieux car bonne isolation
297;Lyon;Mercure Lyon Centre Beaux Arts;3.0;"L;hôtel est bien situé sur la presqu’île, Mais la salle du petit déjeuner est petite et la qualité du petit déjeuneur laisse à désirer...L'hôtel ne dispose pas de parking, ne propose pas de tarif préférentiel pour le parking public le plus proche."
298;Lyon;Mercure Lyon Centre Beaux Arts;4.0;Chambre confortable, hôtel super bien situé dans le 2ème arrondissement, Vieille Ville à côté et surtout pas loin des bouchons !   Personnel très prévenants, merci pour les adresses des bouchons !  Dommage que l'hôtel ne dispose pas d'un parking !
299;Lyon;Mercure Lyon Centre Beaux Arts;4.0;Nous y avons passés deux nuits dans une chambre privilège. La chambre est belle, propre, la literie est bonne, les attentions faites dans la chambre privilège sont vraiment bien avec le peignoir, les pantoufles, les produits de beauté Nuxe, mais surtout un mini bar avec 1coca classique, 1 coca zéro, 1 jus d’orange, 1 Evian et une Badoit offert et remis le lendemain également! Cela n’a l’air de rien mais c’était pas négligeable compte tenu du fait que le premier soir nous sommes revenus du concert de Ed Sheeran avec un petit moment d’attente dans les transports en commun! Nous avons également appréciés le petit déjeuner qui était vraiment de bonne qualité avec du sale, du sucre, des viennoiseries de très bonnes qualités (chose que nous avons du mal à trouver)! Bref c’était top!…
300;Lyon;Mercure Lyon Centre - Gare Part Dieu;4.0;Séjour d'une nuit. Propre, bon petit déjeuner et bon rapport qualité prix.  Accueil agréable et rapide.Nous avions tout payé par internet. La chambre familiale était disponible dès notre arrivé le midi.
301;Lyon;Mercure Lyon Centre - Gare Part Dieu;5.0;Tout est très bien, sauf les protège-matelas plastifiés que je trouve très désagréables. J'ai eu la chance d'être surclassé ce qui m'a permis de bénéficier d'une table et d'un fer à repasser : dommage que ce service ne soit pas offert dans toutes les chambres
302;Lyon;Mercure Lyon Centre - Gare Part Dieu;5.0;Séjour après séjour : accueil toujours parfait, prestations impeccables tant au niveau des chambres, que pour le petit déjeuner. Bravo ! Ne changez rien tout est vraiment au top. La carte de fidélité est un vrai avantage : j’apprécie les « plus » que procure cette carte 
303;Lyon;Mercure Lyon Centre - Gare Part Dieu;5.0;Séjour improvisé d'une seule soirée à la Gare de Lyon Part-Dieu en raison des grèves SNCF. Moi qui suis très habitué des Novotel et Mercure j'ai été absolument ravi de la chambre qui m'a été attribuée en surclassement (suite Tony Garnier au 7ee étage). Sincèrement j'ai trouvé la déco, le confort et l'ambiance de ce quartier de l'hôtel absolument magnifiques. Devant repartir très tôt le lendemain matin je n'ai malheureusement pas pu profiter des parties communes de l'hôtel et du petit déjeuner. Mais ce que j'en ai vu me donne grande envie d'y faire un stop plus prolongé!! C'était parfait!
304;Lyon;Mercure Lyon Centre - Gare Part Dieu;5.0;Excellent service comme à chaque fois. Le restaurant est très bien et le rapport qualité - prix est très bien. Que ce soit à l'accueil pour l'arrivée comme pour le départ ainsi qu'au bar ou au restaurant, le personnel est serviable et très pro
305;Lyon;Mercure Lyon Centre - Gare Part Dieu;5.0;La chambre était spacieuse, très confortable et bien insonorisée. Le personnel est attentif et disponible. L'hôtel est très bien placé. il y a une station de Velov juste devant. Très bonne expérience, on reviendra.
306;Lyon;Mercure Lyon Centre - Gare Part Dieu;5.0;Excellent . Check in et check out rapide. Chambre propre et très pratique si vous prenez un TGV très tôt au départ de Lyon part dieu,  Très bonne insonorisation, on n’entends ni les voisins ni les trains ni la rue
307;Lyon;Mercure Lyon Centre - Gare Part Dieu;4.0;Nous sommes venus une première fois et avons été un peu déçus par la chambre (lavabo bouché, température très élevée dans la chambre...) et en avions informé la réception.  Ayant trouvé l'accueil très agréable, nous sommes néanmoins revenus quelques semaines plus tard. Nous avons été reconnus et surclassés en dédommagement du 1er séjour. Tout à été positif cette 2nde fois et il faut insister sur le professionnalisme particulièrement aimable du personnel
308;Lyon;Mercure Lyon Centre - Gare Part Dieu;5.0;Très bon hôtel. Bien situé, très belle chambre, personnel attentionné et très courtois. Prestations conformes aux attentes, restaurant agréable pour le petit déjeuner, parking au sous sol et tramway juste à côté.
309;Lyon;Mercure Lyon Centre - Gare Part Dieu;5.0;Hotel moderne et propre. Grande chambre à la deco contemporaine . Literie impeccable .Bonne insonorisation. Bien situé pour voyager en train et transports en commun   Petit déjeuner très complet et de qualité . 
310;Lyon;Mercure Lyon Centre - Gare Part Dieu;5.0;Emplacement idéal à 2 pas de la gare sncf. Commerces et transports urbains  à proximité. Chambre très spacieuse avec un équipement haut de gamme. Isolation phonique parfaite et ambiance feutrée. A recommandé. 
311;Lyon;Mercure Lyon Centre - Gare Part Dieu;5.0;Je reviens 2fois par mois , toujours dans le même hôtel.  La propreté est parfaite , le room service aussi  je reviendrai jusqu’au mois de juin date de la fin de ma formation.  Hôtel très bien situé à 2 minutes de la gare part Dieu 
312;Lyon;Mercure Lyon Centre - Gare Part Dieu;4.0;Des collaborateurs à l'écoute avec un sens aigu de vouloir faire plaisir, quoi de plus satisfaisant pour un client ! Le plus difficile sera de maintenir ce cap. Un effort pourrait être fait sur les plats proposés. Un peu plus de finesse dans l'exécution me semblerait plus opportun, surtout à Lyon !   
313;Lyon;Mercure Lyon Centre - Gare Part Dieu;5.0;Personnel charmant et très à l’écoute Restaurant bon et service rapide Chambre spacieuse et propreté impeccable Isolation phonique efficace Calme malgré chambre donnant sur rue très passante Petit déjeuner copieux
314;Lyon;Mercure Lyon Centre - Gare Part Dieu;5.0;Qualité des services et accueil toujours aussi bien et agréable  Établissement dans lequel on se sent bien  Tout est parfait de l’accueil, le service bar, les femmes de service : gentillesse, politesse et sourire 
315;Lyon;Mercure Lyon Centre - Gare Part Dieu;5.0;Très bon accueil, service impeccable et personnel compétent  Très bon restaurant et petit déjeuner pour tous les goûts  Très bons renseignements sur la ville et possibilité de tourisme Proximité des transports en commun 
316;Lyon;Mercure Lyon Centre - Gare Part Dieu;4.0;tres bien tres bon sejour petite attention a l arrivee a l hotel une photophore et des pralines offerts fete de la lumiere  bon accueil hotel calme bien situer bouilloire cafe tisane bouteille d eau dans la chambre  à refaire
317;Lyon;Mercure Lyon Centre - Gare Part Dieu;4.0;la localisation de l'hotel est pratique , l'accueil est bien , le diner au restaurent reste très moyen , le parking devrait être offert la chambre est propre , le rapport qualité prix est moyen  pour le petit dejeuner prévoir des grandes tasses
318;Lyon;Mercure Lyon Centre - Gare Part Dieu;4.0;De passage à Lyon avant de prendre l'avion. Bien situé en face du Rhône Express qui vous transporte en 30 minute à l'aéroport.... Accueil sympa, chambres et propres petit déjeuner très bien aussi. Rien à dire. Si vous pouviez diminuer le nombre de mots pour rédiger l'avis ce serait très bien par contre.....
319;Lyon;Mercure Lyon Centre - Gare Part Dieu;5.0;Excellent hôtel tout proche de la gare Part Dieu, chambres spacieuses, personnel charmant, repas avec spécialités locales. Idéal pour tout voyageur qui transite par la gare. Très silencieux malgré la spécialité.
320;Lyon;Mercure Lyon Centre - Gare Part Dieu;4.0;Hôtel situé à deux pas de la gare part Dieu  Grandes chambres, literie excellente, bien insonorisé. Seul bémol, impossible de régler la température dans la chambre ...température excessive... Petit déjeuner très correct 
321;Lyon;Mercure Lyon Centre - Gare Part Dieu;4.0;Si je ne notais que l'hôtel je lui donnerais 5 étoiles. Mais dans un quartier aussi sinistre que Partdieu, composé uniquement d'immeubles de bureau... et d'une gare, difficile de faire abstraction du restaurant, je l'inclus donc dans la note, ce qui fait lui perdre une étoile.  Côté hôtellerie, donc, c'est très, très réussi. Les chambres sont spacieuses, confortables, bien décorées et surtout, silencieuses, ce qui est rare. Côté gare il y a un quadruple vitrage! Alors que le moindre bruit m'empêche de dormir, là, ce fut le paradis. Petit déjeuner correct, mais paradoxalement moins impressionnant que celui de l'Ibis Gerland, pourtant moins cher, et appartenant à un hôtel du même groupe, mais moins luxueux!  Et justement, cela nous amène au restaurant, justement, le vrai point…
322;Lyon;Mercure Lyon Centre - Gare Part Dieu;5.0;L’hôtel jouxte la gare Part Dieu (très pratique pour voir les trains qui fonctionnent en cette période de grève mi octobre), il faut toutefois marcher un peu pour atteindre le métro (l’hôtel précédent était de l’autre côté de la gare). Vaste espace d’accueil, grande chambre à l’excellente literie, petit déjeuner varié et bon. Le restaurant (un dîner) est très bien lui aussi, avec une carte courte mais réussie. Excellent séjour de 4 nuits durant le Festival de cinéma Lumière, pour un rapport qualité-prix très honorable.
323;Lyon;Mercure Lyon Centre - Gare Part Dieu;5.0;plusieurs fois déjà réservé dans ce Mercure toujours aussi bien. C'est sur que pour mon prochain séjour à Lyon  je réserverai dans cet hotel proche du centre ville et de la gare ce qui est appréciable et pratique.
324;Lyon;Mercure Lyon Centre - Gare Part Dieu;4.0;De passage une nuit à Lyon pour un déplacement professionnel, j’ai dormi dans cet hôtel à côté de la Gare de Lyon Part-Dieu. Les chambres sont grandes et spacieuses, de même que les salles de bain. C’est aussi très calme même si l’on a la vue sur les quais de la gare. Très bien pour une ou deux nuits si on est de passage à Lyon. Cet hôtel est loin du centre-ville historique par contre, si on est à Lyon pour du tourisme. 
325;Lyon;Mercure Lyon Centre - Gare Part Dieu;4.0;Hôtel dont les chambres sont très spacieuses et confortables. La proximité immédiate de la gare Part Dieu en est un atout . Malgré une vue au dessus des rails de la gare ou du tramway le silence est omniprésent dans la chambre La SDB est très grande et les toilettes sont séparés Petit bémol sur le pdj qui pourrait être un peu plus fournis ( saumon, produits locaux, pains variés ...) En tout cas expérience j y reviendrai sans problème 
326;Lyon;Mercure Lyon Centre - Gare Part Dieu;4.0;Chambre spacieuse , belle salle  eau et wc sépare.personnel professionnel.45mn du vieux centre , parking public à 1/2 prix avec l l'hotel. Bien de très près de la gare on n entend pas du tout les trains .
327;Lyon;Mercure Lyon Centre - Gare Part Dieu;4.0;Établissement bien placé et très agréable.Avec une carte business plus je pensais avoir un autre accueil. La chambre parfaite. L'accueil au bar moins sympathique. Pas de sourire et aucune attention délicate sinon vous surveiller pour savoir combien de café vous avez consommé.
328;Lyon;Mercure Lyon Centre - Gare Part Dieu;5.0;Y séjourner 1 fois,c'est l'adopter :-) Très satisfaite à chacun de mes séjours à Lyon.  Hotel très agréable et idéalement situé à coté de la gare. Tres bien insonorisé et calme. J'apprécie le style des chambres. Accueil très professionnel et une équipe à l'écoute. Le buffet petit déjeuner est vraiment formidable, beaucoup de choix et des produits de qualité.  Merci à vous !
329;Lyon;Mercure Lyon Centre - Gare Part Dieu;4.0;Tout est OK, proche de tous les transports en commun. Seul problème, ils ont oublié de me créditer une nuit sur ma carte Accor Hôtels! Un hôtel à recommander tant pour les affaires que pour le tourisme.
330;Lyon;Mercure Lyon Centre - Gare Part Dieu;4.0;Plus: chambre spacieuse, propre et confortable. Nous avions demandé une chambre au calme, ceci a été respecté, nous avons apprécié. Bien placé, petit déjeuner de qualité. Moins: réceptionniste assez froide. Ne nous a pas expliqué la caution lors du paiement, nous avons dû demandé la raison des 250€ au lieu de 158€ (prix de la chambre). 1 seule bouteille d'eau offerte pour deux personnes (50cl), peu de thé dans la chambre, la petite capsule d'huiles essentielles pour la douche payantes 2.50€( je pense qu'ils pourraient en offrir une). Coin bar très petit nus avons dû recevoir nos filles pour boire un verre dans notre chambre. Des petits détails certes, mais qui amélioreraient l'impression générale.
331;Lyon;Mercure Lyon Centre - Gare Part Dieu;5.0;Un service digne d’un 5 étoiles ,je suis fidèle à l’hôtel Mercure par Dieu ...personnel avenant merci pour le service de chambre au personnel et au petits soins merci YANN,propreté irréprochable je recommande vivement 
332;Lyon;Mercure Lyon Centre - Gare Part Dieu;5.0;Bien placé et très agréable, personnel sympa et serviable. Chambre vaste et petit-déjeuner copieux. Proximité de la gare et métro et donc facile d'aller visiter la ville. Sans oublier de prendre un verre au bar!
333;Lyon;Mercure Lyon Centre - Gare Part Dieu;5.0;Etant énormément en déplacement, les hôtels Mercure sont une valeur sûre, une chambre spacieuse , des prestations de qualité .l'ajout de produit NUXE  pour la douche est un réel plus . Le petit déjeuné et le service associé était très bien . 
334;Lyon;Mercure Lyon Centre - Gare Part Dieu;3.0;Venu en groupe de travail pour déjeuner. Dans l'ensemble, rien d'exceptionnel : même si nous avons demandé un service plutôt rapide (fait en 1h15), très peu de choix proposé (2 entrées / 2 plats / 2 desserts), service un peu fait à la va-vite par des gens. Prix acceptable, cuisine très correcte .  Je pense que même si cela peut convenir si l'on loge au Mercure même, il y 'a assurément mieux dans les alentours pour le même prix voire moins cher.
335;Lyon;Mercure Lyon Centre - Gare Part Dieu;5.0;Emplacement privilégié au coeur de Lyon et jouxtant la gare de la part dieu. la chambre est très belle et spacieuse, une très bielle réalisation. Le petit déjeuner copieux et varié avec un personnel au petit soin.  
336;Lyon;Mercure Lyon Centre - Gare Part Dieu;1.0;A deux pas de la gare de la Part Dieu, j’avais l’habitude de venir pour des rendez-vous professionnels où l’espace de détente permettait de boire un café ou un thé tout en travaillant ou en rencontrant mes interlocuteurs.  Désormais, cet espace est uniquement accessible aux co workers sur réservation et surtout moyennant la modeste somme de 18€ par demi journée.  Malgré plus de 100€ d’addition au restaurant, nous nous sommes vus opposer une fin de non recevoir ou une réduction généreuse de trois euros.  Plus jamais je n’y mettrai les pieds.  Quelle ridicule politique commerciale ! Et quel manque de sens du client...
337;Lyon;Mercure Lyon Centre - Gare Part Dieu;5.0;je travaille sur la moitié de la france et les hôtels Mercure sont en général mes choix privilégiés. Ce Mercure fait parti des tous meilleurs . les chambres sont spacieuses et très bien équipées. La décoration est a agréable et  l'isolation phonique très performante malgré la gare très proche impossible d'entendre un TGV. Bravo un hôtel à recommander
338;Lyon;Mercure Lyon Centre - Gare Part Dieu;4.0;"Lors de notre venue en 2014, nous avions trouvé cet hôtel parfait et excellent en tout points, et en gardions un excellent souvenir. Et ce mois-ci, nous avons trouvé qu'il y a du relâchement ... Le ménage n'est pas vraiment fait à fond, traces de saletés sur un interrupteur, moquette pas vraiment nickel, et tartre dans la cuvette des toilettes (essayez le vinaigre blanc, c'est magique ;)  Déco toujours impec, insonorisation plus que parfaite : il y a des travaux côté gare, mais on n'entends rien. Les voisins de chambre, on ne les entends pas, on se croirait seul à l'étage. Literie parfaite, sommeil de rêve :)  Puis vint le petit-déjeuner en chambre. Coup de téléphone, on nous réponds aussitôt de façon très agréable et très prévenante, nous sommes servis peu de temps après, c'est…"
339;Lyon;Mercure Lyon Centre - Gare Part Dieu;4.0;"l'hotel est très bien place si on veut être dans le secteur LYON PART DIEU ; il est très proche de la gare, du tram et des bus. Les chambres sont très spacieuses, et très bien insonorisées.  le petit déjeuner est varié et copieux. Le personnel très sympatique. "
340;Lyon;Mercure Lyon Centre - Gare Part Dieu;4.0;Hôtel près de la gare et des trams et métros.  chambre grande et bien arrangée  Service très professionnel et le personnel très souriant le restaurant petite carte mais excellent et service rapide et de très conseil    
341;Lyon;Mercure Lyon Centre - Gare Part Dieu;5.0;A côté de la gare, à côté de la station de tram venant de l'aéroport. Centre névralgique pour explorer à pieds la ville et ses quartiers. Chambre à double fenêtre, le repos assuré. Un personnel discret et professionnel. Tout cela dans un décor de bon goût, sans débordement. Une oasis de repos.
342;Lyon;Mercure Lyon Centre - Gare Part Dieu;5.0;Habituée aux hôtels de gamme supérieure j’étais quelque peu inquiète quant au confort « mercure ». Ce séjour a levé tous,les doutes. Des infrastructures spacieuses et agréables, un personnel accueillant chaleureux et disponible. La chambre très confortable. Tous ces éléments ont fait de ce séjour un moment parfait. 
343;Lyon;Mercure Lyon Centre - Gare Part Dieu;4.0;Les chambres sont bien tenues. L hôtel est assez récent. La literie est bonne et l insonorisation semble parfaite. Le petit Déjeuner est très correct. Très pratique l’hôtel est juste à la sortie de Lyon Part-Dieu
344;Lyon;Mercure Lyon Centre - Gare Part Dieu;4.0;Situé à 2 minutes de la gare, 10 du centre commercial Part Dieu, c’est un hôtel très bien placé. Chambre confortable et bien insonorisée, WC sépare de la salle de douche.  Petit-déjeuner buffet tout à fait correct.
345;Lyon;Mercure Lyon Centre - Gare Part Dieu;5.0;"Personnel super sympa, accueil chaleureux, tout était parfait ou presque. J'avais réservé une chambre ""privilège"" et le bar était sensé être regarni tous les jours. Cela n'a pas été le cas et finalement, il a fallu que je descende à l'accueil pour demander les boissons / chips qui manquaient dans le minibar. Sinon tout était parfait."
346;Lyon;Mercure Lyon Centre - Gare Part Dieu;5.0;L'emplacement de l'hôtel est loin du Vieux Lyon. Il ne dispose pas de parking privé.  Le parking couvert public est accessible de l'hôtel mais un peu cher même si on peut bénéficier de 50% de réduction.  Le personnel est courtois et souriant. Je vous le recommande 
347;Lyon;Mercure Lyon Centre - Gare Part Dieu;4.0;Hôtel récent à côté de la gare de la part Dieu. Tout est conforme aux normes Mercure, accueil chaleureux du personnel. Chambres parfaites pour du professionnel. Garage par contre assez étroit pour un immeuble neuf. À recommander sans problème pour du professionnel sur Lyon ou Villeurbanne.
348;Lyon;Mercure Lyon Centre - Gare Part Dieu;5.0;Cet hôtel est très bien situé : juste à côté du grand centre commercial, de la gare et du métro. Nous avons garé notre voiture au parking souterrain et avons tout fait en métro.  Belle chambre, propre. Petit déjeuner pour tous les goûts.  Nous y redescendons dès que nous voulons aller à Lyon.
349;Lyon;Mercure Lyon Centre - Gare Part Dieu;5.0;Des personnes très gentilles, une chambre magnifique, un excellent repas au restaurant.  Tout pour passer un séjour agréable .  Accès au tram juste en face de l’hôtel, ce qui permet de se déplacer facilement
350;Lyon;Mercure Lyon Centre Château Perrache;5.0;Excellent hôtel avec un personnel souriant et prévenant avec des réponses a nos demandes  J'ai plaisir à revenir car les chambres sont confortables avec un bin rapport qualité prix J'aurais plaisir à revenir 
351;Lyon;Mercure Lyon Centre Château Perrache;5.0;"Je n'ai eu jusqu'ici que d'agréables séjours au Château Perrache et le plus récent ne se soustrait pas à la règle: excellent service de la réception qui m'a surclassé dans une magnifique chambre de certainement 30 m2 avec vue sur Fourvière, machine à Nespresso et frigo avec softs offerts; très bonne aide du réceptionniste de nuit (jeudi 5) pour m'aider à retrouver mon portable égaré en ville. Bar magnifique. Hôtel à l'ancienne mais très bien rénové. Bien que  apparemment coincé entre autoroute urbaine et chemin de fer, aucun souci grâce à une excellente insonorisation extérieure. Globalement, si tous les Mercure pouvaient ressembler à celui-ci (cadre et service) , j'y logerais systématiquement."
